{
   "ServiceId":1234,
   "Name":"Service Name",
   "Description":"Service Description",
   "Status":"Active",
   "Type":"Internet",
   "Zone":"Center",
   "TotalRackNumber":100,
   "FreeRackNumber":50,
   "PerformanceStatus":"OK",
   "QualityServiceStatus":"OK",
   "NetworkTest":"OK",
   "Traffic":"OK",
   "TroubleTicket":[
      {
         "TicketId":"1",
         "link":{
            "rel":"/linkrels/networkService/ticket/info",
            "uri":"/network/service/1234/ticket/1",
            "method":"GET"
         }
      },
      {
         "TicketId":"2",
         "link":{
            "rel":"/linkrels/networkService/ticket/info",
            "uri":"/network/service/1234/ticket/2",
            "method":"GET"
         }
      }
   ],
   "Customers":[
      {
         "CustomerId":"1",
         "link":{
            "rel":"/linkrels/networkService/Customer/info",
            "uri":"/network/service/1234/customer/1",
            "method":"GET"
         }
      },
      {
         "CustomerId":"2",
         "link":{
            "rel":"/linkrels/networkService/Customer/info",
            "uri":"/network/service/1234/customer/1",
            "method":"GET"
         }
      }
   ],
   "links":[
      {
         "rel":"/linkrels/networkService/info",
         "uri":"/network/service/1234",
         "method":"GET"
      },
      {
         "rel":"/linkrels/networkService/updateInfo",
         "uri":"/network/service/1234",
         "method":"PUT"
      },
      {
         "rel":"/linkrels/networkService/delete",
         "uri":"/network/service/1234",
         "method":"DELETE"
      }
   ]
}